{
  "schema_version": "1.0.0",
  "dataset_id": "procedural-e2-binary-v1",
  "case_count": 1,
  "semantic_digest": "aaaaaaaaaaaaaaaaaaaaaaaaaaaaaaaaaaaaaaaaaaaaaaaaaaaaaaaaaaaaaaaa",
  "evaluation": {
    "passed": true,
    "exact_topology_rate": 1.0,
    "shared_boundary_invariant_rate": 1.0,
    "hard_failure_count": 0,
    "baseline_node_advantage": {"vtracer": 0.25},
    "baseline_comparison_count": {"vtracer": 1},
    "no_subpixel_rmse_delta": 0.01,
    "bezier_only_node_delta": 4.0,
    "criteria": {"exact_topology_at_least_95_percent": true}
  },
  "measurements": [
    {
      "case_id": "binary-e2-000",
      "runner": "engine-auto",
      "status": "success",
      "exact_topology": true,
      "premultiplied_rgba_rmse": 0.01,
      "node_count": 4,
      "wall_time_ms": 8.0,
      "message": ""
    }
  ]
}
